{
  "api_version": "0.1.0",
  "status": "calculated",
  "event_type": "Wedding",
  "provenance": {
    "result_kind": "mock_test_fixture",
    "is_trained_model_prediction": false,
    "model_version": null,
    "rules_version": "0.1.0-review",
    "config_version": "0.1.0-mock-test-only",
    "config_sha256": "1afe173fb1956299bff7190ef04b58e3178c98a045fad6f565dee87b176f064f",
    "warning": "TEST VALUES ONLY \u2014 NOT MARKET DATA OR TRAINED PREDICTIONS"
  },
  "costs": {
    "currency": "LKR",
    "estimate_lkr": 151900.0,
    "estimate_kind": "mock_test_rule_estimate",
    "uncertainty_interval": null,
    "line_items": [
      {
        "item_id": "catering",
        "category": "catering",
        "quantity": 100,
        "unit": "LKR/person",
        "rate_lkr": 1000,
        "net_lkr": 100000.0,
        "tax_lkr": 0.0,
        "gross_lkr": 100000.0,
        "included_in": null,
        "evidence_ref": "MOCK-UNIT-TEST-NOT-A-VENDOR-QUOTE",
        "tax_scope": "inclusive"
      },
      {
        "item_id": "chairs",
        "category": "equipment_rental",
        "quantity": 100,
        "unit": "LKR/chair",
        "rate_lkr": 100,
        "net_lkr": 10000.0,
        "tax_lkr": 0.0,
        "gross_lkr": 10000.0,
        "included_in": null,
        "evidence_ref": "MOCK-UNIT-TEST-NOT-A-VENDOR-QUOTE",
        "tax_scope": "inclusive"
      },
      {
        "item_id": "tables",
        "category": "equipment_rental",
        "quantity": 10,
        "unit": "LKR/table",
        "rate_lkr": 500,
        "net_lkr": 5000.0,
        "tax_lkr": 0.0,
        "gross_lkr": 5000.0,
        "included_in": null,
        "evidence_ref": "MOCK-UNIT-TEST-NOT-A-VENDOR-QUOTE",
        "tax_scope": "inclusive"
      },
      {
        "item_id": "stage",
        "category": "equipment_rental",
        "quantity": 12,
        "unit": "LKR/m2",
        "rate_lkr": 100,
        "net_lkr": 1200.0,
        "tax_lkr": 0.0,
        "gross_lkr": 1200.0,
        "included_in": null,
        "evidence_ref": "MOCK-UNIT-TEST-NOT-A-VENDOR-QUOTE",
        "tax_scope": "inclusive"
      },
      {
        "item_id": "av",
        "category": "av",
        "quantity": 1,
        "unit": "LKR/kit",
        "rate_lkr": 5000,
        "net_lkr": 5000.0,
        "tax_lkr": 0.0,
        "gross_lkr": 5000.0,
        "included_in": null,
        "evidence_ref": "MOCK-UNIT-TEST-NOT-A-VENDOR-QUOTE",
        "tax_scope": "inclusive"
      },
      {
        "item_id": "lighting",
        "category": "lighting",
        "quantity": 1,
        "unit": "LKR/kit",
        "rate_lkr": 2000,
        "net_lkr": 2000.0,
        "tax_lkr": 0.0,
        "gross_lkr": 2000.0,
        "included_in": null,
        "evidence_ref": "MOCK-UNIT-TEST-NOT-A-VENDOR-QUOTE",
        "tax_scope": "inclusive"
      },
      {
        "item_id": "labour",
        "category": "labour",
        "quantity": 36.0,
        "unit": "LKR/person-hour",
        "rate_lkr": 200,
        "net_lkr": 7200.0,
        "tax_lkr": 0.0,
        "gross_lkr": 7200.0,
        "included_in": null,
        "evidence_ref": "MOCK-UNIT-TEST-NOT-A-VENDOR-QUOTE",
        "tax_scope": "inclusive"
      },
      {
        "item_id": "venue_fixed",
        "category": "venue_rental",
        "quantity": 1,
        "unit": "LKR/booking",
        "rate_lkr": 10000,
        "net_lkr": 10000.0,
        "tax_lkr": 0.0,
        "gross_lkr": 10000.0,
        "included_in": null,
        "evidence_ref": "MOCK-UNIT-TEST-NOT-A-VENDOR-QUOTE",
        "tax_scope": "inclusive"
      },
      {
        "item_id": "venue_hourly",
        "category": "venue_rental",
        "quantity": 4,
        "unit": "LKR/hour",
        "rate_lkr": 1000,
        "net_lkr": 4000.0,
        "tax_lkr": 0.0,
        "gross_lkr": 4000.0,
        "included_in": null,
        "evidence_ref": "MOCK-UNIT-TEST-NOT-A-VENDOR-QUOTE",
        "tax_scope": "inclusive"
      },
      {
        "item_id": "security",
        "category": "security",
        "quantity": 1,
        "unit": "LKR/booking",
        "rate_lkr": 3000,
        "net_lkr": 3000.0,
        "tax_lkr": 0.0,
        "gross_lkr": 3000.0,
        "included_in": null,
        "evidence_ref": "MOCK-UNIT-TEST-NOT-A-VENDOR-QUOTE",
        "tax_scope": "inclusive"
      },
      {
        "item_id": "decoration",
        "category": "decoration",
        "quantity": 1,
        "unit": "LKR/booking",
        "rate_lkr": 2000,
        "net_lkr": 2000.0,
        "tax_lkr": 0.0,
        "gross_lkr": 2000.0,
        "included_in": null,
        "evidence_ref": "MOCK-UNIT-TEST-NOT-A-VENDOR-QUOTE",
        "tax_scope": "inclusive"
      },
      {
        "item_id": "transport",
        "category": "transport",
        "quantity": 1,
        "unit": "LKR/booking",
        "rate_lkr": 1000,
        "net_lkr": 1000.0,
        "tax_lkr": 0.0,
        "gross_lkr": 1000.0,
        "included_in": null,
        "evidence_ref": "MOCK-UNIT-TEST-NOT-A-VENDOR-QUOTE",
        "tax_scope": "inclusive"
      },
      {
        "item_id": "misc",
        "category": "misc",
        "quantity": 1,
        "unit": "LKR/booking",
        "rate_lkr": 500,
        "net_lkr": 500.0,
        "tax_lkr": 0.0,
        "gross_lkr": 500.0,
        "included_in": null,
        "evidence_ref": "MOCK-UNIT-TEST-NOT-A-VENDOR-QUOTE",
        "tax_scope": "inclusive"
      },
      {
        "item_id": "equipment_other",
        "category": "equipment_rental",
        "quantity": 1,
        "unit": "LKR/booking",
        "rate_lkr": 1000,
        "net_lkr": 1000.0,
        "tax_lkr": 0.0,
        "gross_lkr": 1000.0,
        "included_in": null,
        "evidence_ref": "MOCK-UNIT-TEST-NOT-A-VENDOR-QUOTE",
        "tax_scope": "inclusive"
      }
    ]
  },
  "budget_constraints": {
    "initial_budget_lkr": 1000000.0,
    "contingency_reserve_lkr": 15190.0,
    "operating_allowance_lkr": 984810.0,
    "headroom_lkr": 848100.0,
    "reserve_is_expense": false
  },
  "risk_indicators": {
    "planned_budget_breach": false,
    "planned_operating_allowance_breach": false,
    "expected_profit_lkr": 1048100.0,
    "expected_margin_points": 87.34166666666667,
    "minimum_margin_points": 20,
    "planned_margin_shortfall": false,
    "predicted_probabilities": null
  },
  "spatial": {
    "usable_area_m2": 400,
    "used_area_m2": 182.0,
    "stage_area_m2": 12,
    "space_utilization": 0.455,
    "planned_seats": 100,
    "capacity_persons": 200,
    "layout_origin": "mock_test_fixture",
    "safety_certification": false
  },
  "operations": {
    "general_staff_count": 6,
    "person_hours": 36,
    "overtime_person_hours": 0,
    "furniture_tables": 10,
    "av_kits": 1,
    "lighting_kits": 1
  },
  "outcome_labels": {
    "Budget_Overrun": null,
    "Profit_Margin_Risk": null,
    "Vendor_Cost_Anomaly": null,
    "label_origin": "unavailable"
  },
  "financial_health_score": null,
  "blockers": []
}