{
  "api_version": "0.1.0",
  "status": "blocked",
  "event_type": "Wedding",
  "provenance": {
    "result_kind": "deterministic_rule_estimate",
    "is_trained_model_prediction": false,
    "model_version": null,
    "rules_version": "0.1.0-review",
    "config_version": "0.1.0-template",
    "config_sha256": "89723bf8684ccab23b6be58cc218253de049f37c2da9a70a99d143af2753d7ed",
    "warning": "Provisional rules; approval and evidence required"
  },
  "costs": null,
  "budget_constraints": null,
  "risk_indicators": null,
  "spatial": null,
  "operations": null,
  "outcome_labels": {
    "Budget_Overrun": null,
    "Profit_Margin_Risk": null,
    "Vendor_Cost_Anomaly": null,
    "label_origin": "unavailable"
  },
  "financial_health_score": null,
  "blockers": [
    "bundle_inclusions_unresolved",
    "formula_approval:A001",
    "formula_approval:A007",
    "formula_approval:A008",
    "formula_approval:A009",
    "formula_approval:A010",
    "formula_approval:A011",
    "formula_approval:A012",
    "formula_approval:A013",
    "formula_approval:A014",
    "formula_approval:A015",
    "formula_approval:A020",
    "formula_approval:A021",
    "formula_approval:A022",
    "formula_approval:A023",
    "formula_approval:A024",
    "formula_approval:A027",
    "formula_approval:A028",
    "formula_approval:A029",
    "formula_approval:A033",
    "missing_or_invalid_parameter:area_per_standard_seat_m2",
    "missing_or_invalid_parameter:area_per_vip_seat_m2",
    "missing_or_invalid_parameter:base_staff",
    "missing_or_invalid_parameter:capacity_persons",
    "missing_or_invalid_parameter:circulation_area_m2",
    "missing_or_invalid_parameter:clearance_hours",
    "missing_or_invalid_parameter:event_hours",
    "missing_or_invalid_parameter:excluded_area_m2",
    "missing_or_invalid_parameter:expected_receipts_lkr",
    "missing_or_invalid_parameter:extra_general_staff",
    "missing_or_invalid_parameter:guest_count",
    "missing_or_invalid_parameter:guests_per_staff",
    "missing_or_invalid_parameter:initial_budget_lkr",
    "missing_or_invalid_parameter:minimum_margin_points",
    "missing_or_invalid_parameter:overtime_multiplier",
    "missing_or_invalid_parameter:regular_paid_hours_limit",
    "missing_or_invalid_parameter:reserve_ratio",
    "missing_or_invalid_parameter:seated_share",
    "missing_or_invalid_parameter:seats_per_table",
    "missing_or_invalid_parameter:service_area_m2",
    "missing_or_invalid_parameter:setup_hours",
    "missing_or_invalid_parameter:stage_length_m",
    "missing_or_invalid_parameter:stage_width_m",
    "missing_or_invalid_parameter:venue_area_m2",
    "missing_or_invalid_parameter:vip_seats",
    "missing_or_invalid_parameter:vip_tables",
    "missing_or_invalid_rate:av",
    "missing_or_invalid_rate:catering",
    "missing_or_invalid_rate:chairs",
    "missing_or_invalid_rate:decoration",
    "missing_or_invalid_rate:equipment_other",
    "missing_or_invalid_rate:labour",
    "missing_or_invalid_rate:lighting",
    "missing_or_invalid_rate:misc",
    "missing_or_invalid_rate:security",
    "missing_or_invalid_rate:stage",
    "missing_or_invalid_rate:tables",
    "missing_or_invalid_rate:transport",
    "missing_or_invalid_rate:venue_fixed",
    "missing_or_invalid_rate:venue_hourly",
    "parameter_approval_missing",
    "poc_requires_explicit_package_catering",
    "rate_evidence_missing:av",
    "rate_evidence_missing:catering",
    "rate_evidence_missing:chairs",
    "rate_evidence_missing:decoration",
    "rate_evidence_missing:equipment_other",
    "rate_evidence_missing:labour",
    "rate_evidence_missing:lighting",
    "rate_evidence_missing:misc",
    "rate_evidence_missing:security",
    "rate_evidence_missing:stage",
    "rate_evidence_missing:tables",
    "rate_evidence_missing:transport",
    "rate_evidence_missing:venue_fixed",
    "rate_evidence_missing:venue_hourly",
    "rate_unapproved:av",
    "rate_unapproved:catering",
    "rate_unapproved:chairs",
    "rate_unapproved:decoration",
    "rate_unapproved:equipment_other",
    "rate_unapproved:labour",
    "rate_unapproved:lighting",
    "rate_unapproved:misc",
    "rate_unapproved:security",
    "rate_unapproved:stage",
    "rate_unapproved:tables",
    "rate_unapproved:transport",
    "rate_unapproved:venue_fixed",
    "rate_unapproved:venue_hourly",
    "staff_bundle_scope_unresolved",
    "tax_scope_unresolved:av",
    "tax_scope_unresolved:catering",
    "tax_scope_unresolved:chairs",
    "tax_scope_unresolved:decoration",
    "tax_scope_unresolved:equipment_other",
    "tax_scope_unresolved:labour",
    "tax_scope_unresolved:lighting",
    "tax_scope_unresolved:misc",
    "tax_scope_unresolved:security",
    "tax_scope_unresolved:stage",
    "tax_scope_unresolved:tables",
    "tax_scope_unresolved:transport",
    "tax_scope_unresolved:venue_fixed",
    "tax_scope_unresolved:venue_hourly"
  ]
}